Q 93201005,OSD: ICV LOC,OSD: ICV LOCALIZATION ECC LE IN,OSD: ICV LOCOSD: ICV LOCALIZATION ECC LE IN
Q 93201006,OSD: ICV LOC,OSD: ICV LOCALIZATION ECC LE CN,OSD: ICV LOCOSD: ICV LOCALIZATION ECC LE CN
Q 93200887,OSD: ESRV RS,OSD: ESRV RSLAF OCC PROCESS EXPERT,OSD: ESRV RSOSD: ESRV RSLAF OCC PROCESS EXPERT
Q 93200888,OSD: ESRV CC,OSD: ESRV CCM ARCHITECT,OSD: ESRV CCOSD: ESRV CCM ARCHITECT
Q 93200889,OSD: ESRV CC,OSD: ESRV CCM TOOLS IMPLEMENTATION,OSD: ESRV CCOSD: ESRV CCM TOOLS IMPLEMENTATION
Q 93200890,OSD: ESRV CC,OSD: ESRV CCM PROCESSES OPTIMIZATION,OSD: ESRV CCOSD: ESRV CCM PROCESSES OPTIMIZATION
Q 93200891,OSD: ICV LOC,OSD: ICV LOCALIZATION ECC FI BR,OSD: ICV LOCOSD: ICV LOCALIZATION ECC FI BR
Q 93200975,OSD: ESRV RS,OSD: ESRV RSLAF OCC ARCHITECT,OSD: ESRV RSOSD: ESRV RSLAF OCC ARCHITECT
Q 93200977,OSD: ESRV MA,OSD: ESRV MAINTOPT ARCHITECT,OSD: ESRV MAOSD: ESRV MAINTOPT ARCHITECT
Q 93200978,OSD: TDMS,OSD: TDMS,OSD: TDMS   OSD: TDMS
Q 93200892,OSD: ICV LOC,OSD: ICV LOCALIZATION ECC FI RU,OSD: ICV LOCOSD: ICV LOCALIZATION ECC FI RU
Q 93200893,OSD: ICV LOC,OSD: ICV LOCALIZATION ECC FI IN,OSD: ICV LOCOSD: ICV LOCALIZATION ECC FI IN
Q 93200894,OSD: ICV LOC,OSD: ICV LOCALIZATION ECC FI CN,OSD: ICV LOCOSD: ICV LOCALIZATION ECC FI CN
Q 93200895,OSD: ICV LOC,OSD: ICV LOCALIZATION ECC MM BR,OSD: ICV LOCOSD: ICV LOCALIZATION ECC MM BR
Q 93200896,OSD: ICV LOC,OSD: ICV LOCALIZATION ECC MM RU,OSD: ICV LOCOSD: ICV LOCALIZATION ECC MM RU
Q 93200897,OSD: ICV LOC,OSD: ICV LOCALIZATION ECC MM IN,OSD: ICV LOCOSD: ICV LOCALIZATION ECC MM IN
Q 93200898,OSD: ICV LOC,OSD: ICV LOCALIZATION ECC MM CN,OSD: ICV LOCOSD: ICV LOCALIZATION ECC MM CN
Q 93200899,OSD: ICV LOC,OSD: ICV LOCALIZATION ECC SD BR,OSD: ICV LOCOSD: ICV LOCALIZATION ECC SD BR
Q 93201000,OSD: ICV LOC,OSD: ICV LOCALIZATION ECC SD RU,OSD: ICV LOCOSD: ICV LOCALIZATION ECC SD RU
Q 93201001,OSD: ICV LOC,OSD: ICV LOCALIZATION ECC SD IN,OSD: ICV LOCOSD: ICV LOCALIZATION ECC SD IN
Q 93201058,OSD: IT PLAN,OSD: IT PLANNING,OSD: IT PLANOSD: IT PLANNING
Q 93201026,OSD: CRM DVM,OSD: CRM DVM,OSD: CRM DVMOSD: CRM DVM
QK93100034,OSD: BW,OSD: BW,OSD: BW     OSD: BW
QK93100125,OSD: SECURIT,OSD: SECURITY,OSD: SECURITOSD: SECURITY
QK93100126,OSD: HANA,OSD: HANA,OSD: HANA   OSD: HANA
QK93100152,OSD: ENGINEE,OSD: ENGINEERING SERVICES (ESRV),OSD: ENGINEEOSD: ENGINEERING SERVICES (ESRV)
QK93100153,OSD: ESRV RA,OSD: ESRV RAPID PROTOTYPING,OSD: ESRV RAOSD: ESRV RAPID PROTOTYPING
QK93100155,OSD: ESRV RS,OSD: ESRV RSLAF BUS. PROC. OPERATIONS,OSD: ESRV RSOSD: ESRV RSLAF BUS. PROC. OPERATIONS
QK93100200,OSD: I/O STA,OSD: I/O STACK,OSD: I/O STAOSD: I/O STACK
QK93100201,OSD: HIGH AV,OSD: HIGH AVAIL. / DISASTER RECOVERY,OSD: HIGH AVOSD: HIGH AVAIL. / DISASTER RECOVERY
QK93100225,OSD: ESRV AL,OSD: ESRV ALM,OSD: ESRV ALOSD: ESRV ALM
QK93100226,OSD: ESRV AL,OSD: ESRV ALM REQ TO TEST,OSD: ESRV ALOSD: ESRV ALM REQ TO TEST
QK93100227,OSD: ESRV AL,OSD: ESRV ALM GOVERNANCE,OSD: ESRV ALOSD: ESRV ALM GOVERNANCE
QK93100228,OSD: ESRV IM,OSD: ESRV IMPLEMENT. COUNTRY VERSION,OSD: ESRV IMOSD: ESRV IMPLEMENT. COUNTRY VERSION
QK93100250,OSD: ESRV RS,OSD: ESRV RSLAF OPERATION CONTROL CENTER,OSD: ESRV RSOSD: ESRV RSLAF OPERATION CONTROL CENTER
QK93100251,OSD: ESRV MA,OSD: ESRV MAINTENANCE AND UPGRADE ENG.,OSD: ESRV MAOSD: ESRV MAINTENANCE AND UPGRADE ENG.
Q 93201600,OSD: CAPACIT,OSD: CAPACITY MANAGEMENT / SIZING,OSD: CAPACITOSD: CAPACITY MANAGEMENT / SIZING
QK93100325,OSD: BACKOFF,OSD: BACKOFFICE,OSD: BACKOFFOSD: BACKOFFICE
Q 93201300,OSD: SERV. P,OSD: SERV. PREP. HEALTHCHECK,OSD: SERV. POSD: SERV. PREP. HEALTHCHECK
Q 93201375,OSD: SUITE O,OSD: SUITE ON HANA,OSD: SUITE OOSD: SUITE ON HANA
Q 93200777,OSD: BOBJ AD,OSD: BOBJ ANALYSIS OFFICE,OSD: BOBJ ADOSD: BOBJ ANALYSIS OFFICE
Q 93201425,OSD: BOBJ AN,OSD: BOBJ ANALYSIS OLAP,OSD: BOBJ ANOSD: BOBJ ANALYSIS OLAP
Q 93201426,OSD: BOBJ DE,OSD: BOBJ DESIGN STUDIO,OSD: BOBJ DEOSD: BOBJ DESIGN STUDIO
Q 93201427,OSD: SAP LUM,OSD: SAP LUMIRA (VISUAL INTELLIGENCE),OSD: SAP LUMOSD: SAP LUMIRA (VISUAL INTELLIGENCE)
Q 93201428,OSD: HANA LI,OSD: HANA LIVE,OSD: HANA LIOSD: HANA LIVE
Q 93201429,OSD: PLANNIN,OSD: PLANNING APPLICATION KIT (PAK),OSD: PLANNINOSD: PLANNING APPLICATION KIT (PAK)
Q 93201400,OSD: USER EX,OSD: USER EXPERIENCE (UX) GENERAL,OSD: USER EXOSD: USER EXPERIENCE (UX) GENERAL
QK93100350,OSD: USER EX,OSD: USER EXPERIENCE (UX),OSD: USER EXOSD: USER EXPERIENCE (UX)
Q 93201401,OSD: USER RE,OSD: USER RESEARCH,OSD: USER REOSD: USER RESEARCH
Q 93201402,OSD: CCOE US,OSD: CCOE USER EXPERIENCE (UX),OSD: CCOE USOSD: CCOE USER EXPERIENCE (UX)
Q 93201403,OSD: DESIGN,OSD: DESIGN THINKING,OSD: DESIGN OSD: DESIGN THINKING
Q 93201404,OSD: SAP FIO,OSD: SAP FIORI,OSD: SAP FIOOSD: SAP FIORI
Q 93201405,OSD: SAPUI5,OSD: SAPUI5,OSD: SAPUI5 OSD: SAPUI5
Q 93201406,OSD: USER EX,OSD: USER EXP. (UX) RAPID PROTOTYPE,OSD: USER EXOSD: USER EXP. (UX) RAPID PROTOTYPE
Q 93201407,OSD: AFS SD,OSD: AFS SD WITH ALLOCATION RUN,OSD: AFS SD OSD: AFS SD WITH ALLOCATION RUN
Q 93201408,OSD: AFS MAN,OSD: AFS MANUFACTURING (MM UND PP),OSD: AFS MANOSD: AFS MANUFACTURING (MM UND PP)
Q 93200451,OSD: MOBILE,OSD: MOBILE PLATFORM ? SMP / SUP,OSD: MOBILE OSD: MOBILE PLATFORM ? SMP / SUP
Q 93200449,OSD: MOBILE,OSD: MOBILE ? NETWEAVER DOE,OSD: MOBILE OSD: MOBILE ? NETWEAVER DOE
Q 93201411,OSD: MOBILE,OSD: MOBILE PLATFORM - MOBILISER,OSD: MOBILE OSD: MOBILE PLATFORM - MOBILISER
Q 93201412,OSD: SAP NET,OSD: SAP NETWEAVER GATEWAY,OSD: SAP NETOSD: SAP NETWEAVER GATEWAY
Q 93201525,OSD: SAP PRE,OSD: SAP PREDICTIVE ANALYSIS,OSD: SAP PREOSD: SAP PREDICTIVE ANALYSIS
Q 93201526,OSD: ECC GEN,OSD: ECC GENERALIST,OSD: ECC GENOSD: ECC GENERALIST
Q 93201527,OSD: SCM GEN,OSD: SCM GENERALIST,OSD: SCM GENOSD: SCM GENERALIST
Q 93201528,OSD: CRM GEN,OSD: CRM GENERALIST,OSD: CRM GENOSD: CRM GENERALIST
Q 93201529,OSD: SRM GEN,OSD: SRM GENERALIST,OSD: SRM GENOSD: SRM GENERALIST
Q 93201530,OSD: HCM GEN,OSD: HCM GENERALIST,OSD: HCM GENOSD: HCM GENERALIST
Q 93201531,OSD: BOBJ GE,OSD: BOBJ GENERALIST,OSD: BOBJ GEOSD: BOBJ GENERALIST
Q 93201532,OSD: ECC FIN,OSD: ECC FIN. SUPPLY CHAIN MGMT (FSCM),OSD: ECC FINOSD: ECC FIN. SUPPLY CHAIN MGMT (FSCM)
Q 93201533,OSD: ECC MAT,OSD: ECC MATERIAL LEDGER,OSD: ECC MATOSD: ECC MATERIAL LEDGER
Q 93201534,OSD: ESRV AL,OSD: ESRV ALM BUS. PROC. CHA. ANA.(BPCA),OSD: ESRV ALOSD: ESRV ALM BUS. PROC. CHA. ANA.(BPCA)
Q 93201535,OSD: ECC BUS,OSD: ECC BUS. RULE FRAMEWORK PLUS (BRF+),OSD: ECC BUSOSD: ECC BUS. RULE FRAMEWORK PLUS (BRF+)
Q 93201536,OSD: DB SYBA,OSD: DB SYBASE IQ,OSD: DB SYBAOSD: DB SYBASE IQ
Q 93201537,OSD: BOBJ DQ,OSD: BOBJ DQM (DATA QUALITY MGMT.),OSD: BOBJ DQOSD: BOBJ DQM (DATA QUALITY MGMT.)
Q 93201538,OSD: CC CONV,OSD: CC CONVERGENT CHARGING (CC),OSD: CC CONVOSD: CC CONVERGENT CHARGING (CC)
Q 93201539,OSD: CC CONV,OSD: CC CONVERGENT INV. AND BILLING (CI),OSD: CC CONVOSD: CC CONVERGENT INV. AND BILLING (CI)
Q 93201540,OSD: HYBRIS,OSD: HYBRIS,OSD: HYBRIS OSD: HYBRIS
Q 93201541,OSD: SUCCESS,OSD: SUCCESSFACTORS FUNCTIONAL,OSD: SUCCESSOSD: SUCCESSFACTORS FUNCTIONAL
Q 93201542,OSD: SUCCESS,OSD: SUCCESSFACTORS TECHNICAL,OSD: SUCCESSOSD: SUCCESSFACTORS TECHNICAL
Q 93201543,OSD: ARIBA G,OSD: ARIBA GENERALIST,OSD: ARIBA GOSD: ARIBA GENERALIST
Q 93201544,OSD: ARIBA N,OSD: ARIBA NETWORK,OSD: ARIBA NOSD: ARIBA NETWORK
Q 93201545,OSD: ARIBA P,OSD: ARIBA PROCUREMENT CONTENT - CATALOG,OSD: ARIBA POSD: ARIBA PROCUREMENT CONTENT - CATALOG
Q 93201546,OSD: ARIBA P,OSD: ARIBA PROCUREMENT ? P2P,OSD: ARIBA POSD: ARIBA PROCUREMENT ? P2P
Q 93201547,OSD: ARIBA I,OSD: ARIBA INVOICEPRO,OSD: ARIBA IOSD: ARIBA INVOICEPRO
Q 93201548,OSD: ARIBA P,OSD: ARIBA PAYMENTPRO,OSD: ARIBA POSD: ARIBA PAYMENTPRO
Q 93201549,OSD: ARIBA S,OSD: ARIBA SERVICES PROCUREMENT,OSD: ARIBA SOSD: ARIBA SERVICES PROCUREMENT
Q 93201550,OSD: ARIBA S,OSD: ARIBA SOURCING,OSD: ARIBA SOSD: ARIBA SOURCING
Q 93201551,OSD: ARIBA C,OSD: ARIBA CONTRACTS MANAGEMENT PRO,OSD: ARIBA COSD: ARIBA CONTRACTS MANAGEMENT PRO
Q 93201552,OSD: ARIBA S,OSD: ARIBA SUPPL. INFORM. & PERF. MGMT.,OSD: ARIBA SOSD: ARIBA SUPPL. INFORM. & PERF. MGMT.
Q 93201553,OSD: ARIBA S,OSD: ARIBA SPEND VISIBILITY,OSD: ARIBA SOSD: ARIBA SPEND VISIBILITY
Q 93201554,OSD: SAP HAN,OSD: SAP HANA CLOUD INTEG. (DS) FOR S&OP,OSD: SAP HANOSD: SAP HANA CLOUD INTEG. (DS) FOR S&OP
Q 93201555,OSD: SUITE O,OSD: SUITE ON HANA,OSD: SUITE OOSD: SUITE ON HANA
Q 93201725,OSD: FOCUS T,OSD: FOCUS TQM,OSD: FOCUS TOSD: FOCUS TQM
Q 93201726,OSD: SCM SAL,OSD: SCM SALES & OPER. PLANNING (S&OP),OSD: SCM SALOSD: SCM SALES & OPER. PLANNING (S&OP)
